<?xml version="1.0" encoding="UTF-8"?>
<!-- Configuration file for the traceability tool. -->
<TraceablitiyToolsConfiguration
	xmlns:xsi="http://www.w3.org/2001/XMLSchema-instance"
	xsi:noNamespaceSchemaLocation="app-config.xsd" version="2">

	<!-- General configuration -->
	<GeneralConfigurationSection>
		<!-- The directory where the GIT checkout for all applications is present -->
		<BaseGitDirectory>#EXECUTION_DIR#/test/input/git-base-dir</BaseGitDirectory>
		<!-- Definition of the relative paths to different elements inside a project directory -->
		<ProjectRelativePathConfiguration>
			<!-- Relative path to the directory containing the specification documents -->
			<ToSdFiles>Documentation/SD</ToSdFiles>
			<!-- Relative path to the directory containing the ALM extracted files -->
			<ToAlmExtractedFiles>ALM_Extract</ToAlmExtractedFiles>
			<!-- Relative path to the directory containing the extracted requirement file (from SD) -->
			<ToExtractedReqFiles>Documentation/SD_Reqs</ToExtractedReqFiles>
			<!-- Relative path to the directory containing the VTP files -->
			<ToVtpFiles>Documentation/VTP</ToVtpFiles>
			<!-- Relative path to the directory containing the Traceability Matrix file -->
			<ToTmFiles>Documentation/TR</ToTmFiles>
		</ProjectRelativePathConfiguration>
		<!-- The relative path from Git base directory and the directory containing the justification files -->
		<RelativePathToJustificationFiles>general/justifications</RelativePathToJustificationFiles>
		<!-- The simple regular expression for selecting the unit test methods 
			to consider for traceability -->
		<UnitTestMethodSimpleRegexp>VTP_*</UnitTestMethodSimpleRegexp>
	</GeneralConfigurationSection>

	<!-- Configuration for application data -->
	<ApplicationConfigurationSection default="full-app">

		<!-- AIM Tool -->
		<ApplicationConfiguration id="full-app">
			<GeneralCharacteristics>
				<DisplayName>Full application</DisplayName>
				<GitRelativeDirPath>full-app</GitRelativeDirPath>
			</GeneralCharacteristics>
			<SpecificationData>
				<SdFileName>SD-FULL.docx</SdFileName>
				<RequirementPrefixes>
					<RequirementPrefix>REQ-FULL</RequirementPrefix>
				</RequirementPrefixes>
			</SpecificationData>
			<CoverageData>
				<JustificationFileName>justifications.xlsx</JustificationFileName>
				<AlmTestsCoverage isActive="true">
					<AlmExtractedFile>VTP_FULL.xlsm</AlmExtractedFile>
				</AlmTestsCoverage>
				<CucumberTestsCoverage isActive="true">
					<FileSelectionFilter>
						<RootDirectory>code/cucumber</RootDirectory>
						<SearchInSubDirectories>true</SearchInSubDirectories>
						<FilenameSimpleRegexp>*.feature</FilenameSimpleRegexp>
					</FileSelectionFilter>
				</CucumberTestsCoverage>
				<CSharpUnitTestsCoverage isActive="true">
					<FileSelectionFilter>
						<RootDirectory>code/CSharp</RootDirectory>
						<SearchInSubDirectories>true</SearchInSubDirectories>
						<FilenameSimpleRegexp>*.xml</FilenameSimpleRegexp>
					</FileSelectionFilter>
					<MethodSimpleRegexp>VTP_*</MethodSimpleRegexp>
				</CSharpUnitTestsCoverage>
				<JavaUnitTestsCoverage isActive="true">
					<FileSelectionFilter>
						<RootDirectory>code/java</RootDirectory>
						<SearchInSubDirectories>true</SearchInSubDirectories>
						<FilenameSimpleRegexp>*.java</FilenameSimpleRegexp>
					</FileSelectionFilter>
					<MethodSimpleRegexp>VTP_*</MethodSimpleRegexp>
				</JavaUnitTestsCoverage>
			</CoverageData>
			<OutputData>
				<TargetVtpFileName>VTP-FULL.xlsx</TargetVtpFileName>
				<TargetMatrixFileName>full_matrix.xlsx</TargetMatrixFileName>
				<TargetExtractedRequirementsFileName>full_reqs.txt</TargetExtractedRequirementsFileName>
			</OutputData>
		</ApplicationConfiguration>

	</ApplicationConfigurationSection>
</TraceablitiyToolsConfiguration>
